company,city,edu,resumeCount,salary,jobName,detail
北京高因科技有限公司,苏州-吴中区,本科/不限,8,8K-15K,二手房销售6500起薪+房补+名校同事,居理新房(Julive)(原侃家网)——全国最大、口碑最好的新房电商平台作为国内首家数据驱动的新房直卖专业平台，我们的核心业务是向买房人提供全流程免费的高品质新房咨询服务。自2014年成立以来，先后受到了源码资本、K2险峰长青等投资机构的青睐。目前也是业内首家完成B+轮融资的新房直卖专业平台。四年来，公司已经形成了数据和人才的双重竞争壁垒，并积累了领先行业两年的新房大数据营销系统。目前已经领跑房产行业细分赛道——新房电商领域。公司现在已有北京、天津，上海，苏杭，广州，重庆，成都、深圳、郑州、南京等11个分公司，业务遍及13城。在新房领域的这片蓝海里，居理期待和你一起见证优秀，成就彼此。 我们提供的岗位是——房产咨询师（二手房方向）！这是一封来自居理二手房创始人的亲笔信：       亲爱的同学你好，我想最难过的事，莫过于因为“误解”而错过一个最好的机会！       居理二手房，不是你想象中的“那种”中介模式，更不是一份普普通通的“工作”。        亚马逊CEO贝佐斯有一句名言：人们都在关注未来会发生什么变化，我关注未来什么是不变的。房产行业逐渐进入存量房（二手房）多于增量房（新房）的时代，居理集团开拓二手房业务，是确定不变的方向，不因任何阻力而改变！        过去4年，居理通过大数据线上获客+高学历专业服务，改革了全国13个城市的新房服务质量，接下来会用更优秀的团队、更科学的方法论和工具等改革全国二手房的服务质量。4年期间，众多居理客户希望我们成立二手房事业，造福于需要二手房买卖的用户，如今，万众瞩目的二手房“救世主”终于成立了！        新业务开拓者，会成为真正的元老，更会收获超乎想象的成长、晋升、待遇等，居理2014年的老员工如今都在不同领域独当一面，阿里当年的18罗汉更是各掌千秋。        复制，还是开拓？平庸，还是伟大？只在这个选择——加入我们！不得不承认：选择，大于努力！        今日此刻，踏出舒适区，一起成就一份从0到1的伟大事业！        面对挑战和难题，有些人犹豫、沮丧、逃避，但总有一些人迎难而上、愈挫愈勇，而他们，就是推动世界改变和进步的伟大力量！ 【我们能给您提供的】1.薪酬体系：基本工资6500+高额提成+600房补。（基本工资包括无责任底薪5000+绩效1500，试用期按照基本工资80%发放）其中从18年4月开始实施的绩效与业绩无关，只要你有过硬的执行力，就可以全额拿到。2.重量级大奖：公司月度会投入数万元奖励优秀的咨询师，���炮奖、团队奖等应有尽有。3.多类补贴：每人每月可获得全勤奖+电脑补贴+话费报销+打车报销等。4.福利保障：试用期开始交五险一金+内部员工购房福利+年度体检+年度带薪出游+带薪年假+节假日福利+生日福利+ 每月团建经费。5.全职业生命周期的培训培养体系：从新人到管理者的每个阶段，均有完善的培训课程，且每个新人均配备资深导师进行入职引导及在职指导。①专业培训：入职初期，统一安排集中带薪培训，从地产行业的专业知识到营销咨询的业务技巧全方位覆盖。②引导人制度：资深的咨询师作为入职引导人一对一辅导，直到新员工可以独立且成功的为用户提供完整的咨询服务。③入组培训机制：对于新员工安排入组孵化，即由主管全面培育和孵化，帮助新人达到转正标准实现咨询师转正。④线上自主学习平台——猫头鹰学院，线上培训课程，让学习无处不在。 6.两条个性化晋升通道：专业通道Or 管理通道①专业通道：C1（底薪10万/年） 到C7（底薪30万/年）；②管理通道：咨询师→咨询主管→咨询经理→城市经理→大区经理 。公司成立时，作为第一批新房领域的开战团队，现在已经全部成为各分公司的城市经理以及老牌咨询经理，成为了公司规模扩张中流砥柱的力量！从新人到管理者平均晋升周期为9-12个月，公司有刚转正就做到主管的超强实力新人，有95年的城市经理，你希望自己成为哪一类？7.丰富多彩的员工活动：公司专门设立员工满意部，为员工提供茶歇、零食、甜点等福利，让你上班不枯燥，下班不单调！8.工作环境：办公室均入驻高档写字楼，办公环境宽敞明亮，舒适整洁；公司互联网扁平化管理，氛围轻松融洽。 【我们需要这样的你】1、来自一本及以上院校，统招本科及以上学历【我们的小伙伴34%以上来自海外和国内优秀高校，我们非常期待这样你加入我们，一同成长】；2．认为自己有不错的亲和力、沟通能力和逻辑思维能力，最重要的是要有强烈的目标感；3．有较强的的压力承受能力，愿意和一群加班狂一起工作(我们会出外勤，跑遍全城~)；4．有理想，有抱负，看重自己未来的发展，希望在短期内能提升自己并走向管理要职；5．渴望和一群优秀的同事一起工作，让自己也变得同样优秀（真正公平、公开和谐的工作氛围）； 【你要为公司做什么】1.  维护“居理二手房咨询师”的品牌形象，传递公司良好形象和价值（这一点我们非常重视），提高用户满意度。2.  学习二手房相关专业知识、业务流程和服务标准，参与统一培训并通过考核；3.  进行市场分析及房源调研，发表专业的房源测评、维护房源数据；4.  掌握并运用居理服务标准sop，一对一为业主／买房用户（公司分配）提供专业咨询服务；5.  分析数据并制作报告，为业主／买房人提供客观科学的建议，服务全流程；提示：因每日简历投递量较大，如您在一日之内并未接到HR的电话，可添加微信优先预约面试，获得岗位更多详细信息，机会掌握在自己的手中，你会是那颗发光的金子么？公司地址： 江苏省苏州市工业园区渠诚大厦良禽择木而栖，我在居理新房等你！ 【HR联系方式】姓名：许京晶投递邮箱：*********************（简历直接投递请备注岗位）面试地址：苏州市吴中区工业园区渠诚大厦2层 居理新房公司官网：www.julive.com
佛山中国陶瓷城集团有限公司,佛山,大专/1-3年,0,4K-6K,销售业务/渠道拓展,"岗位职责：1、参与城市合伙人的年度计划的规划与开拓；  2、依据材易采市场战略规划，全力做好各个城市合伙人的开拓，定期达成城市合伙人招募目标与任务；3、负责城市合伙人运营中心的维护和提升影响力； 4、本岗位是业务型岗位，薪资待遇底薪+提成任职要求：1、大专以上学历，21-25岁，加盟开拓经验与项目运作经验丰富，1年以上建材、电器、橱柜、电梯、门窗、家具等相关行业加盟经验者优先；2、具有较强的业务谈判能力和商务技巧，加盟开拓能力强，勇于创新；   3、能适应出差；4、客户资源丰富者优先考虑；能力特别优秀者，条件可适当放宽.平台介绍：佛山中陶城网络科技有限公司材易采平台成立于2017年10月18日，是由中国陶瓷城集团投资，是针对陶瓷卫浴产业打造的全产业链电商平台。以“产业+互联网+金融”为核心路径，以大数据平台为支撑，从经销商、工程买家、厂家痛点需求为切入点，通过整合上下游产业链，配合专业化的团队和标准的服务体系，从而构建“B2B+O2O""的陶瓷卫浴工程直采平台。材易采正式投入运营仅1年，陶瓷卫浴行业战略合作企业已达142家，覆盖90%以上行业一线品牌，整合陶瓷、卫浴、石材、马赛克等相关产业全品类，主要有东鹏、马可波罗、新明珠、蒙娜丽莎、鹰牌、萨米特、兴辉、金意陶、欧神诺、TOTO、科勒、美标、箭牌、恒洁、浪鲸等品牌。公司介绍：公司简介：    佛山中国陶瓷城集团有限公司成立于2001年8月23日，是由广东东鹏陶瓷股份有限公司、广东星星投资控股有限公司共��投资组建，位于有“中国陶瓷之都”与“中国陶瓷商贸之都”之称的广东省佛山市，是集产业地产开发与运营、物业管理、商业管理、资产管理、广告经营、展览组织、电子商务于一体的投资开发与运营管理集团公司。    集团致力于打造以陶瓷为核心业态的家居文化综合服务平台，集团旗下现有中国陶瓷城、中国陶瓷产业总部基地、华夏中央广场、常德东星家居广场、中国（淄博）陶瓷产业总部基地、任丘东星家居广场，材易采七大项目，同时积极投资开发新项目。"
西安丹麦森房屋中介有限公司,西安,不限/不限,1,6K-8K,房产经纪人,"西安易居旗下丹麦森房地产有限公司职位描述：薪资构成：底薪 + 高提成 + 绩效奖金 + 住宿薪资福利 1、入职即可带薪培训，经理主管安排培训新人；2,、入司一经录用提供住宿；3、广阔自由的晋升空间(职位、薪资、合伙人）；4、公司每年安排外出旅游奖励机会 ，拓展训练；5、周末双休，不提倡加班，法定节假日带薪休假；6、良好的员工关怀，员工生日、入职周年祝福、节假日福利发放，带薪年假，给你家人般的温暖；7、舒适的办公环，良好的工作氛围，真诚期待您的加入。 岗位职责：1、公司提供意向客户，通过电话了解客户需求；2、利用公司提供的资源，通过电话、网络、各大商务平台开发客户3、；将需求客户转给对接的销售人员，制作表格并客户追踪。职位要求：任职要求：1. 学历不限；2.热爱销售岗，喜欢挑战新事物，沟通能力较强，吃苦耐劳，抗压能力强。有无经验皆可3.性格开朗活泼，积极向上，有责任心，有良好的沟通及团队协助能力；4.有销售或国外搜素引擎、社交媒体推广，大数据开发相关经验优先；我们的优势：1、西安丹麦森，企业知名度高，客户群体广泛；2、西安丹麦森拥有宽敞明亮的工作环境、温馨和谐的工作氛围；3、西安丹麦森是一个年轻富有朝气的团队，90、00后小伙伴都聚集在此，我们鼓励创新，相信年轻人。上班地址：未央区凤城九路          浐灞二路荣德棕榈阳光"
河北威邦企服网络技术有限公司,石家庄,大专/1-3年,3,5K-8K,5000以上聘网络销售,通缉令下发：全球通缉，招募国际庄最有才华的合伙人，只要你够胆我们就给你展示的空间。三千五千只是起点，月入过万才是我们的小目标，快乐工作，开心生活，是我们唯一的企业文化。我们是一家朝气蓬勃的互联网公司，我们给广大中小企业、事业单位、个体工商户提供最专业的新零售解决方案、DSP大数据精准营销、百度推广、五核一体建站（含PC、手机、微信、APP、小程序）等服务，我们的团队在过去的一年里，创造了傲人的业绩，得到了快速的发展。2018年随着公司扩张我们需要成立两个销售部以及两个分公司。所以需要有才能的你、有胜任我们工作的能力，更希望未来销售部门主管以及分公司负责人非你莫属，我们绝不绝不接受空降，所有任职人员都将内部晋升产生。所以我们给你的不仅是一份工作，而是你可以深耕的事业，股权合伙人。所有的公司都在感慨现在社会缺的是：人才，而我们却认为你恰恰缺的是：胆识，2018未来有你做主，只要你够胆，我们接受你的挑战！河北威邦企服招募最有胆识的合伙人！职位要求一、职位要求 岗位要求： 1.全国统招大专及以上学历，男女不限，24—32岁，性格开朗；2.有ERP软件或CRM软件或SaaS软件2年及以上销售经验，对SaaS企服领域有浓厚的兴趣。3.理解、认同并愿意执行顾问式销售理念；4.语言表达清晰有条理，具备良好的亲和力、沟通力和谈判能力；5.能独立开拓市场，执行力强，能承担较大工作压力，有挑战高薪的激情和勇气；6.熟练运用Word、Excel、PPT、微信、钉钉等PC、移动办公工具；7.有明确的人生规划及近1-3年的成长计划，愿意与公司一起成长。8.条件不符者请勿投递简历。（谢谢）二、岗位职责 1.负责公司SaaS服务类产品的销售，根据销售任务和资源制定自己的销售计划，并按计划进行客户的开发和维护，达成销售目标；2.学习、掌握公司产品，并能够熟练讲解产品的特点和使用方式，充分及时了解行业动态和竞 品特点，提高自身市场敏锐度； 3.认可移动办公理念，以公司移动办公软件进行KPI绩效考核，勇于挑战高薪。4.前期需要各种渠道筛选对标客户；然后对意向客户进行上门拜访，促成销售的达成；5.负责商务谈判、合同的签订及客户回款、客户资料的整理录入； 7.根据产品按年付费模式，合作过后关注客户使用反馈及维护，顺利达成次年续费使用；8.认可终身学习、每天进步的生存理念，积极参与公司培训，与公司一起成长，勇于承担更大  的责任和更高的职务。公司网址：www.weibangqifu.com三、薪资待遇 底薪2500-8000+提成（业绩的6%2525到14%2525）+各种奖励+工龄奖+年终奖 双休五险 工作时间： 工作时间8小时制，双休，无夜班，不倒班； 上午8：30-12：00，下午13：30-18：00四、个人职业发展： 1.员工组长经理，针对不同层次进行针对性培训，帮助员工成长晋升； 2.对每个层级的员工制定了完善的考核制度，享受公平、公正的薪酬调整及晋升机会；五、任职资格： 1、口齿清晰，普通话流利，语音富有感染力； 2、对销售工作有较高的热情； 3、具备较强的学习能力和优秀的沟通能力； 4、性格坚韧，思维敏捷，具备良好的应变能力和承压能力；
北京高因科技有限公司,广州,本科/不限,12,10K-15K,雨燕销售管培生9K起薪+房补+名校同事J10288,居理新房(Julive)——全国最大、口碑最好的新房电商平台作为国内首家数据驱动的新房电商平台，我们的核心业务是向买房人提供全流程免费的高品质新房咨询服务。自2014年成立以来，先后受到了源码资本、K2险峰长青等投资机构的青睐。目前也是业内首家完成B+轮融资的新房电商平台。五年来，公司已经形成了数据和人才的双重竞争壁垒，并积累了领先行业两年的新房大数据营销系统。目前已经领跑房产行业细分赛道——新房电商领域。公司现在已有北京、天津，上海，苏杭，广州，重庆，成都、深圳、郑州、南京、佛山等12个分公司。在新房领域的这片蓝海里，居理期待和你一起见证优秀，成就彼此。 我们提供的岗位是——房产咨询师！月入过万就满足了？不不不，这只是开始！【我们能给您提供的】1、薪酬体系：基本工资9000+满意度奖金+500房补。（基本工资包括无责任底薪7000+绩效2000，试用期按照基本工资80%发放）其中从18年4月开始实施的绩效与业绩无关，只要你有过硬的执行力，就可以全额拿到。2、重量级大奖：公司月度会投入数万元奖励优秀的咨询师，头炮奖、团队奖等应有尽有。另外年度还设置千元现金奖励，年度销冠更有苹果三件套、奔驰宝马等大奖等你来拿。3、多类补贴：每人每月可获得全勤奖+电脑补贴+话费报销+打车报销等。4、福利保障：试用期开始交五险一金+内部员工购房福利+年度体检+年度带薪出游+带薪年假+节假日福利+生日福利+ 每月团建经费。5、全职业生命周期的培训培养体系：从新人到管理者的每个阶段，均有完善的培训课程，且每个新人均配备资深导师进行入职引导及在职指导。①专业培训：入职初期，统一安排约两周的集中带薪培训，从地产行业的专业知识到营销咨询的业务技巧全方位覆盖。②引导人制度：资深的咨询师作为入职引导人一对一辅导，直到新员工可以独立且成功的为用户提供完整的咨询服务。③入组培训机制：对于新员工安排入组孵化，即由主管全面培育和孵化，帮助新人达到转正标准实现咨询师转正。④线上自主学习平台——猫头鹰学院，线上培训课程，让学习无处不在。6、两条个性化晋升通道：专业通道Or 管理通道①专业通道：C1（底薪10万/年） 到C7（底薪30万/年）；②管理通道：咨询师→咨询主管→咨询经理→城市经理→大区经理 。从新人到管理者平均晋升周期为9-12个月，每月均会组织一次管理者公开竞聘。公司有刚转正就做到主管的超强实力新人，有95年的城市经理，你希望自己成为哪一类？7、丰富多彩的员工活动：公司专门设立员工满意部，为员工提供茶歇、零食、甜点等福利，同时还有员工自发组织的读书、撸猫、篮球、健身等各种兴趣小组，让你上班不枯燥，下班不单调！8、工作环境：办公室均入驻高档写字楼，办公环境宽敞明亮，舒适整洁；公司互联网扁平化管理，氛围轻松融洽。9、公司团队：咨询师团队是一支十分具有活力的90后团队；全本科及以上学历的优秀同事，80%的咨询师毕业于一本院校，你必定可以从周围的人身上获益匪浅！ 【我们需要这样的你】1、来自一本及以上院校，统招本科及以上学历【我们的小伙伴34%以上来自海外和国内优秀高校，我们非常期待这样你加入我们，一同成长】；2、认为自己有不错的亲和力、沟通能力和逻辑思维能力；3、有良好的抗打击能力，愿意和一群加班狂一起工作(我们不时会出外勤，跑遍全城~)；4、渴望高收入、渴望在大城市有自己的立足之地；5、渴望和一群优秀的同事一起工作，让自己也变得同样优秀（真正公平、公开和谐的工作氛围）；6、一颗不安分的心、一颗能披荆斩棘的心、一颗热爱沟通的心； 【你要为公司做什么】1、专注提升自己的业务能力，根据从公司分配的客户的实际需求为他们提供专业化的咨询、陪同客户看房，提供专业购房建议，服务用户购房全流程；2、维护“居理咨询师”的品牌形象，传递公司良好形象和价值（这一点我们极其重视，客户第一！），追求用户的高满意度；3、进行市场分析及楼盘调研，发表专业的楼盘测评、维护楼盘数据（不熟悉操作也没关系，我们的入职培训以及引导人会耐心的帮你学习，一同成长）；4、完成每月既定的任务目标，我们看中具体的结果，也注重实现结果的过程——精致专业的服务（追求极致的客户满意度） 【公司地点1】：广州市海珠区新滘中路88号 唯品同创汇（大塘地铁站）【公司地点2】：广州市海珠区江南大道368号星辉豪庭众创空间3楼b01（昌岗地铁站） 良禽择木而栖，我在居理新房等你！
湖南宇电智诚科技开发有限公司,长沙-岳麓区,大专/1-3年,4,4K-8K,python开发工程师,"2年以上工作经验，熟练掌握python开发工具，精通python,django框架，熟练掌握RESTAPI开发，具有python/django版本升级适配经验者优先。熟练掌握ORACLE,SQL SERVER,MY SQL数据库中的一种以上，能使用python独立开发网络爬虫、大数据分析等。•除python外，具有Java或C++开发经验者优先。有MongoDB经验优先。•熟练掌握消息队列，定时，异步任务，具有高并发大数据量系统的开发和维护经验。•具备优秀的逻辑思维能力，对解决挑战性问题充满热情，善于解决问题和分析问题。•良好的团队合作精神，较强的沟通能力。"
启迪国信科技有限公司,青岛,本科/5-10年,3,20K-30K,售前技术经理-智慧水务(001186),岗位职责:1、负责智慧城市项目的前期调研、可行性研究、规划方案设计，挖掘并引导客户需求，针对需求设计解决方案；2、为政府部门或其他客户提供智慧城市相关的业务咨询，主要包括：智慧城市顶层设计、建设需求分析、业务规划及运作建议等；3、配合销售团队进行项目开拓，支持交付团队实施，推动整体项目完成；4、负责招投标工作，包括但不限于标书制作、高层汇报、客户交流、标书讲解等；5、负责编制重点行业整体解决方案以及对应能力构建，并持续完善公司智慧城市整体解决方案；6、领导交办的其他工作。 任职资格:1、大学本科以上，计算机相关专业，5年以上IT行业经验，拥有丰富的智慧城市售前或交付经验，具有大项目招投标经验；2、具备智慧城市项目方案设计和建设经验，了解智慧城市规划与顶层设计、智慧城市解决方案组成及建设模式，牵头承担过（如政务云、智慧政务、智慧园区、智慧旅游、智慧城管、智慧教育等）之一的重大项目咨询；3、掌握IT咨询规划方法，了解ICT解决方案设计与规划，具备较好的技术功底，有较强的文字功底，能够独立撰写技术方案，较强的研究能力与技术跟踪意识；4、熟悉并掌握软件工程、项目管理等相关理论与基本知识，熟悉云计算、大数据等技术；5、逻辑思维能力强，具备良好的沟通和表达能力，以及良好的文档写作能力；6、具备很强的学习能力，团队精神，能承受较大的工作压力和省内短期出差。
