company,city,edu,resumeCount,salary,jobName,detail
贝壳找房,广州-南沙区,大专/不限,2,8K-10K,南沙区链家/底薪5000+/置业顾问/管培生,岗位职责选择南沙，你值得拥有：1、南沙区作为粤港澳大湾区地理几何中心，南沙路网建设总的目标是：通过构建高铁、城际、地铁、高快速路相互衔接的路网体系，用三年时间初步建成“半小时交通圈”，力图打造广州第二个“珠江新城”。2、南沙区充分利用优美的生态环境和独特的岭南水乡文化，以营造一流的人居环境为指引，加快共建粤港澳优质生活圈步伐，将南沙区打造成为珠江口宜居湾区优质生活圈。【岗位职责】1、了解客户的相关背景情况，为客户提供房产咨询服务，并为其设计切实可行的购房和租房方案；2、维护网络端口房源数据，更新公司内部房源信息系统房源数据；3、拜访客户，实勘，上图，带看，设计买卖方案；4、房屋交易合同签订；合同签订后续跟进；5、参与链家集团制定的学习计划，不断提升专业技能。 【职位要求】1、统招专科或以上学历；年龄 20-40岁；2、沟通能力好，形象气质好；3、刻苦耐劳，有强烈的进取心，责任心，有一定的抗压能力；4、该岗位接受实习生/应届生（提供转正机会，需一年之内获取统招专科或以上学历毕业证书；能提供学信网学历认证）；5、实习生均按照正式员工发放薪资及计算提成，享受同等晋升机会 。 【薪酬】★有竞争力的薪酬：试用期底薪4000元+1000元激励金+高提成(28%-77% 上不封顶)；【福利】★行业牛人带你飞：链家学员全方位系统化培训，师徒制一对一教学，让你从职场小白变大神；★大数据平台支持：贝壳网拥有大量真房源+客源；★人性化的工作时间和地点：时间高度自由，工作地点就近分配门店；★透明的晋升机制：经纪小白——资深经纪人——店经理——商圈经理——总监——城市副总——城市总经理；★便利的线上APP：可移动办公，方便快捷，力求不错过任何一个成交机会；我们是一群充满朝气的团队，牛人大咖们平易近人；同事们有激情、有毅力、有信念、有理想；追得了八卦，服得了客户，这里压力与乐趣并存，如果，你懂得销售 欢迎同时向往美好生活 很欢迎又恰巧对房产行业抱有兴趣 热烈欢迎现在，就等你！ 贝壳找房由链家网升级而来，是以技术驱动的品质居住服务平台，聚合和赋能全行业的优质服务者，打造开放的品质居住服务生态，致力于为两亿家庭提供包括二手房、新房、租赁和家装等全方位居住服务。不远的将来，贝壳找房将覆盖全中国超过300个城市，服务超过2亿的社区家庭，连接100万职业经纪人和10万家门店，赋能超过100个品牌。贝壳使命：推动行业正循环，更好服务每个家庭贝壳愿景：成为连接两亿家庭的品质居住服务平台工作地点：广州市南沙区就近分配面试地点：广州市天河区珠江新城珠控国际中心6楼【温馨提示】：由于简历量比较多，如有意向可直接联系贝壳找房HR余小姐***********，微信与手机同号，减短您的等待时间！
上海链家房地产经纪有限公司,上海,本科/无经验,3,8K-12K,带明星看房-陆家嘴豪宅销售顾问/底薪6k+安排住宿,"由于简历量较大，请针对职位投递一份简历即可，联系HR支文娟：18516176702（微信），15021180581（电话）；电话可优先安排面试哦！集团简介：链家集团，成立于2001年，是一家集房产交易服务、资产管理服务为一体以数据驱动的全价值链房产服务平台，业务覆盖二手房交易、新房交易、租赁、装修服务等。链家目前已覆盖北京、上海、广州、深圳、天津、成都、青岛、重庆、大连、合肥、无锡等32个地区，全国门店数量约8000家，旗下经纪人超过15万名。为不断提高购房服务体验，链家积极布局线上平台。目前线上已覆盖PC端、链家APP、链家网手机版等终端，是具备集房源信息搜索、产品研发、大数据处理、服务标准建立为一体的房产服务平台。平台为买卖双方用户提供全面真实的房产相关信息及咨询服务，并不断提高服务效率、提升服务体验，希望为用户提供更安全、更便捷、更舒心的综合房产服务。链家的愿景是希望通过持之以恒的创新以及新技术的探索和运用，建立和有效管理高质量的房地产服务标准，推动行业进步。区域简介：陆家嘴大区是上海链家主做高端的一个板块，租赁标的从五千到四万不等，买卖五百万到五千万，陆家嘴位于上海市浦东新区的黄浦江畔，隔江面对外滩，主营高端公寓和海景房，对接户。目前需要招募10名销售菁英，和我们一起并肩作战。岗位职责：1、专注上海2000万以上高端公寓和海景房；2、负责客户的接待、咨询工作，为客户提供专业的房地产置业咨询服务；3、负责公司房源的开发、维护与积累，并与业主建立良好的业务协作关系；4、接受客户预约，陪同看房、拜访、洽谈、签约及过户；5、及时跟进业务进度，与客户建立良好的业务协作关系。薪酬福利：1、薪资待遇：第一个月无责底薪6K+3K绩效,第二个月开始5K+3K绩效；累计达到2万业绩转正，转正后综合薪资15000左右，薪资构成：底薪3K+2K绩效+提成租赁50%，买卖20%-70%；有带薪培训和师傅代教。2、全面房产业务知识培训(房地产法规，交易按揭流程，营销实战技巧等)，全程带薪培训专人一对一指导；3、优秀员工可参加“链家集团MVP”（人才储备计划），助你一步步成为优秀领导者！职业发展：管理职：成为团队的领导者置业顾问→店经理→商圈经理→运营总监→事业总专业职：成为豪宅领域的专家置业顾问→高级置业顾问→资深置业顾问任职资格：1、全日制统招本科及以上学历，年龄20-30周岁之间，性别专业不是问题2、有良好的人际沟通能力，性格外向，具备高度的工作热情且有较强观察能力和应变能力；3、工作积极主动，有较强的抗压和抗挫能力4、做事认真踏实，为人正直诚恳，高度的工作意识，具有良好的团队精神联系方式：联系电话：支小姐 18516176702（微信同号，电话联系优先安排面试）面试地址：上海市静安区南京西路东方有线大厦9楼工作地址：全上海市可就近安排地铁路线：13号线/12号线/2号线南京西路地铁站个人邮箱：266699@sh.lianjia.com"
北京高因科技有限公司,苏州-工业园区,本科/不限,16,8K-15K,顾问式销售：6500起薪+晋升快+高福利+房补+名校同事J10289,居理新房(Julive)——全国最大、口碑最好的新房电商平台作为国内首家数据驱动的新房电商平台，我们的核心业务是向买房人提供全流程免费的高品质新房咨询服务。自2014年成立以来，先后受到了源码资本、K2险峰长青等投资机构的青睐。目前也是业内首家完成B+轮融资的新房电商平台。五年来，公司已经形成了数据和人才的双重竞争壁垒，并积累了领先行业两年的新房大数据营销系统。目前已经领跑房产行业细分赛道——新房电商领域。公司现在已有北京、天津，上海，苏杭，广州，重庆，成都、深圳、郑州、南京、佛山等12个分公司。在新房领域的这片蓝海里，居理期待和你一起见证优秀，成就彼此。 我们提供的岗位是——房产咨询师（管理培训生方向）！月入过万就满足了？不不不，这只是开始！【我们能给您提供的】1、薪酬体系：基本工资6500+满意度奖金+600房补。（基本工资包括无责任底薪5000+绩效1500，试用期按照基本工资80%发放）其中从18年4月开始实施的绩效与业绩无关，只要你有过硬的执行力，就可以全额拿到。2、重量级大奖：公司月度会投入数万元奖励优秀的咨询师，头炮奖、团队奖等应有尽有。另外年度还设置千元现金奖励，年度销冠更有苹果三件套、奔驰宝马等大奖等你来拿。3、多类补贴：每人每月可获得全勤奖+电脑补贴+话费报销+打车报销等。4、福利保障：试用期开始交五险一金+内部员工购房福利+年度体检+年度带薪出游+带薪年假+节假日福利+生日福利+ 每月团建经费。5、全职业生命周期的培训培养体系：从新人到管理者的每个阶段，均有完善的培训课程，且每个新人均配备资深导师进行入职引导及在职指导。①专业培训：入职初期，统一安排约两周的集中带薪培训，从地产行业的专业知识到营销咨询的业务技巧全方位覆盖。②引导人制度：资深的咨询师作为入职引导人一对一辅导，直到新员工可以独立且成功的为用户提供完整的咨询服务。③入组培训机制：对于新员工安排入组孵化，即由主管全面培育和孵化，帮助新人达到转正标准实现咨询师转正。④线上自主学习平台——猫头鹰学院，线上培训课程，让学习无处不在。6、两条个性化晋升通道：专业通道Or 管理通道①专业通道：C1（底薪10万/年） 到C7（底薪30万/年）；②管理通道：咨询师→咨询主管→咨询经理→城市经理→大区经理 。从新人到管理者平均晋升周期为9-12个月，每月均会组织一次管理者公开竞聘。公司有刚转正就做到主管的超强实力新人，有95年的城市经理，你希望自己成为哪一类？7、丰富多彩的员工活动：公司专门设立员工满意部，为员工提供茶歇、零食、甜点等福利，同时还有员工自发组织的读书、撸猫、篮球、健身等各种兴趣小组，让你上班不枯燥，下班不单调！8、工作环境：办公室均入驻高档写字楼，办公环境宽敞明亮，舒适整洁；公司互联网扁平化管理，氛围轻松融洽。9、公司团队：咨询师团队是一支十分具有活力的90后团队；全本科及以上学历的优秀同事，80%的咨询师毕业于一本院校，你必定可以从周围的人身上获益匪浅！ 【我们需要这样的你】1、来自一本及以上院校，统招本科及以上学历【我们的小伙伴34%以上来自海外和国内优秀高校，我们非常期待这样你加入我们，一同成长】；2、认为自己有不错的亲和力、沟通能力和逻辑思维能力；3、有良好的抗打击能力，愿意和一群加班狂一起工作(我们不时会出外勤，跑遍全城~)；4、渴望高收入、渴望在大城市有自己的立足之地；5、渴望和一群优秀的同事一起工作，让自己也变得同样优秀（真正公平、公开和谐的工作氛围）；6、一颗不安分的心、一颗能披荆斩棘的心、一颗热爱沟通的心； 【你要为公司做什么】1、专注提升自己的业务能力，根据从公司分配的客户的实际需求为他们提供专业化的咨询、陪同客户看房，提供专业购房建议，服务用户购房全流程；2、维护“居理咨询师”的品牌形象，传递公司良好形象和价值（这一点我们极其重视，客户第一！），追求用户的高满意度；3、进行市场分析及楼盘调研，发表专业的楼盘测评、维护楼盘数据（不熟悉操作也没关系，我们的入职培训以及引导人会耐心的帮你学习，一同成长）；4、完成每月既定的任务目标，我们看中具体的结果，也注重实现结果的过程——精致专业的服务（追求极致的客户满意度） 【公司地点1】：苏州市工业园区渠诚大厦（松涛街站）
北京高因科技有限公司,苏州-工业园区,本科/不限,14,8K-15K,顾问式销售6500起薪+房补+名校同事+快晋升-J10289,居理新房(Julive)——全国最大、口碑最好的新房电商平台北京高因科技有限公司（品牌居理新房）作为国内首家数据驱动的新房电商平台，我们的核心业务是向买房人提供全流程免费的高品质新房咨询服务。自2014年成立以来，先后受到了源码资本、K2险峰长青等投资机构的青睐。目前也是业内首家完成B+轮融资的新房电商平台。五年来，公司已经形成了数据和人才的双重竞争壁垒，并积累了领先行业两年的新房大数据营销系统。目前已经领跑房产行业细分赛道——新房电商领域。公司现在已有北京、天津，上海，苏杭，广州，重庆，成都、深圳、郑州、南京、佛山等12个分公司。在新房领域的这片蓝海里，居理期待和你一起见证优秀，成就彼此。 我们提供的岗位是——房产咨询师！月入过万就满足了？不不不，这只是开始！【我们能给您提供的】1、薪酬体系：基本工资6500+满意度奖金+600房补。（基本工资包括无责任底薪5000+绩效1500，试用期按照基本工资80%发放）其中从18年4月开始实施的绩效与业绩无关，只要你有过硬的执行力，就可以全额拿到。2、重量级大奖：公司月度会投入数万元奖励优秀的咨询师，头炮奖、团队奖等应有尽有。另外年度还设置千元现金奖励，年度销冠更有苹果三件套、奔驰宝马等大奖等你来拿。3、多类补贴：每人每月可获得全勤奖+电脑补贴+话费报销+打车报销等。4、福利保障：试用期开始交五险一金+内部员工购房福利+年度体检+年度带薪出游+带薪年假+节假日福利+生日福利+ 每月团建经费。5、全职业生命周期的培训培养体系：从新人到管理者的每个阶段，均有完善的培训课程，且每个新人均配备资深导师进行入职引导及在职指导。①专业培训：入职初期，统一安排约两周的集中带薪培训，从地产行业的专业知识到营销咨询的业务技巧全方位覆盖。②引导人制度：资深的咨询师作为入职引导人一对一辅导，直到新员工可以独立且成功的为用户提供完整的咨询服务。③入组培训机制：对于新员工安排入组孵化，即由主管全面培育和孵化，帮助新人达到转正标准实现咨询师转正。④线上自主学习平台——猫头鹰学院，线上培训课程，让学习无处不在。6、两条个性化晋升通道：专业通道Or 管理通道①专业通道：C1（底薪10万/年） 到C7（底薪30万/年）；②管理通道：咨询师→咨询主管→咨询经理→城市经理→大区经理 。从新人到管理者平均晋升周期为9-12个月，每月均会组织一次管理者公开竞聘。公司有刚转正就做到主管的超强实力新人，有95年的城市经理，你希望自己成为哪一类？7、丰富多彩的员工活动：公司专门设立员工满意部，为员工提供茶歇、零食、甜点等福利，同时还有员工自发组织的读书、撸猫、篮球、健身等各种兴趣小组，让你上班不枯燥，下班不单调！8、工作环境：办公室均入驻高档写字楼，办公环境宽敞明亮，舒适整洁；公司互联网扁平化管理，氛围轻松融洽。9、公司团队：咨询师团队是一支十分具有活力的90后团队；全本科及以上学历的优秀同事，80%的咨询师毕业于一本院校，你必定可以从周围的人身上获益匪浅！ 【我们需要这样的你】1、来自一本及以上院校，统招本科及以上学历【我们的小伙伴34%以上来自海外和国内优秀高校，我们非常期待这样你加入我们，一同成长】；2、认为自己有不错的亲和力、沟通能力和逻辑思维能力；3、有良好的抗打击能力，愿意和一群加班狂一起工作(我们不时会出外勤，跑遍全城~)；4、渴望高收入、渴望在大城市有自己的立足之地；5、渴望和一群优秀的同事一起工作，让自己也变得同样优秀（真正公平、公开和谐的工作氛围）；6、一颗不安分的心、一颗能披荆斩棘的心、一颗热爱沟通的心； 【你要为公司做什么】1、专注提升自己的业务能力，根据从公司分配的客户的实际需求为他们提供专业化的咨询、陪同客户看房，提供专业购房建议，服务用户购房全流程；2、维护“居理咨询师”的品牌形象，传递公司良好形象和价值（这一点我们极其重视，客户第一！），追求用户的高满意度；3、进行市场分析及楼盘调研，发表专业的楼盘测评、维护楼盘数据（不熟悉操作也没关系，我们的入职培训以及引导人会耐心的帮你学习，一同成长）；4、完成每月既定的任务目标，我们看中具体的结果，也注重实现结果的过程——精致专业的服务（追求极致的客户满意度） 【公司地点1】：苏州市工业园区渠诚大厦（松涛街站）良禽择木而栖，我在居理新房等你！
北京云房数据技术有限责任公司,北京,本科/3-5年,180,15K-20K,高级java开发工程师,主要职责：1）        负责公司产品技术架构设计、核心模块编码，完成相关设计文档；2）        带领技术人员完成新技术预研、技术难题攻关；3）        落实公司技术、编码规范，提升产品质量；4）        负责公司核心产品的体验、性能、功能的持续升级优化与创新； 技能要求：1）        计算机软件相关专业本科以上学历，3年以上工作经验；2）        具有扎实的操作系统、多线程、数据结构、计算机网络等基础知识；3）        熟练使用Java开发，；4）        熟悉Linux系统应用开发；5）        熟悉MySQL、Redis、Neo4J数据库至少一种关系数据库；6）        熟悉Spring体系各开源框架；7）        具有Spark、Hadoop、Storm、Kafka等大数据应用开发经验者优先；
北京高因科技有限公司,苏州-工业园区,本科/不限,12,8K-15K, 顾问式销售 【6500起薪+600房补+名校同事】 J10289,居理新房(Julive)——全国最大、口碑最好的新房电商平台居理新房（北京高因科技）作为国内首家数据驱动的新房电商平台，我们的核心业务是向买房人提供全流程免费的高品质新房咨询服务。自2014年成立以来，先后受到了源码资本、K2险峰长青等投资机构的青睐。目前也是业内首家完成B+轮融资的新房电商平台。五年来，公司已经形成了数据和人才的双重竞争壁垒，并积累了领先行业两年的新房大数据营销系统。目前已经领跑房产行业细分赛道——新房电商领域。公司现在已有北京、天津，上海，苏杭，广州，重庆，成都、深圳、郑州、南京、佛山等12个分公司。在新房领域的这片蓝海里，居理期待和你一起见证优秀，成就彼此。 我们提供的岗位是——房产咨询师（雨燕管培生）！月入过万就满足了？不不不，这只是开始！【我们能给您提供的】1、薪酬体系：基本工资6500+满意度奖金+600房补。（基本工资包括无责任底薪5000+绩效1500，试用期按照基本工资80%发放）其中从18年4月开始实施的绩效与业绩无关，只要你有过硬的执行力，就可以全额拿到。2、重量级大奖：公司月度会投入数万元奖励优秀的咨询师，头炮奖、团队奖等应有尽有。另外年度还设置千元现金奖励，年度销冠更有苹果三件套、奔驰宝马等大奖等你来拿。3、多类补贴：每人每月可获得全勤奖+电脑补贴+话费报销+打车报销等。4、福利保障：试用期开始交五险一金+内部员工购房福利+年度体检+年度带薪出游+带薪年假+节假日福利+生日福利+ 每月团建经费。5、全职业生命周期的培训培养体系：从新人到管理者的每个阶段，均有完善的培训课程，且每个新人均配备资深导师进行入职引导及在职指导。①专业培训：入职初期，统一安排约两周的集中带薪培训，从地产行业的专业知识到营销咨询的业务技巧全方位覆盖。②引导人制度：资深的咨询师作为入职引导人一对一辅导，直到新员工可以独立且成功的为用户提供完整的咨询服务。③入组培训机制：对于新员工安排入组孵化，即由主管全面培育和孵化，帮助新人达到转正标准实现咨询师转正。④线上自主学习平台——猫头鹰学院，线上培训课程，让学习无处不在。6、两条个性化晋升通道：专业通道Or 管理通道①专业通道：C1（底薪10万/年） 到C7（底薪30万/年）；②管理通道：咨询师→咨询主管→咨询经理→城市经理→大区经理 。从新人到管理者平均晋升周期为9-12个月，每月均会组织一次管理者公开竞聘。公司有刚转正就做到主管的超强实力新人，有95年的城市经理，你希望自己成为哪一类？7、丰富多彩的员工活动：公司专门设立员工满意部，为员工提供茶歇、零食、甜点等福利，同时还有员工自发组织的读书、撸猫、篮球、健身等各种兴趣小组，让你上班不枯燥，下班不单调！8、工作环境：办公室均入驻高档写字楼，办公环境宽敞明亮，舒适整洁；公司互联网扁平化管理，氛围轻松融洽。9、公司团队：咨询师团队是一支十分具有活力的90后团队；全本科及以上学历的优秀同事，80%的咨询师毕业于一本院校，你必定可以从周围的人身上获益匪浅！ 【我们需要这样的你】1、来自一本及以上院校，统招本科及以上学历【我们的小伙伴34%以上来自海外和国内优秀高校，我们非常期待这样你加入我们，一同成长】；2、认为自己有不错的亲和力、沟通能力和逻辑思维能力；3、有良好的抗打击能力，愿意和一群加班狂一起工作(我们不时会出外勤，跑遍全城~)；4、渴望高收入、渴望在大城市有自己的立足之地；5、渴望和一群优秀的同事一起工作，让自己也变得同样优秀（真正公平、公开和谐的工作氛围）；6、一颗不安分的心、一颗能披荆斩棘的心、一颗热爱沟通的心； 【你要为公司做什么】1、专注提升自己的业务能力，根据从公司分配的客户的实际需求为他们提供专业化的咨询、陪同客户看房，提供专业购房建议，服务用户购房全流程；2、维护“居理咨询师”的品牌形象，传递公司良好形象和价值（这一点我们极其重视，客户第一！），追求用户的高满意度；3、进行市场分析及楼盘调研，发表专业的楼盘测评、维护楼盘数据（不熟悉操作也没关系，我们的入职培训以及引导人会耐心的帮你学习，一同成长）；4、完成每月既定的任务目标，我们看中具体的结果，也注重实现结果的过程——精致专业的服务（追求极致的客户满意度） 【公司地点1】：苏州市工业园区渠诚大厦（松涛街站）良禽择木而栖，我在居理新房等你！
中经网数据有限公司,北京,本科/1-3年,1,6K-12K,销售经理,"岗位：销售经理/区域总监（信用方向）职责：1、负责全国各省市区域的信用监测推广工作，前期需先熟悉产品和市场并负责商务部分的工作，后期转为区域销售总监　　2、维护老客户关系，保持与各地方政府机构长期稳定的合作关系3、了解各地区经济及信用相关情况，及时把握市场和项目动态4、主动挖掘潜在用户,能贴合客户需求提供前期咨询及跟进，获得客户认可，与客户沟通谈判并达成合作，不断积累客户资源，开拓信用市场5、负责合作洽谈、合同签订、工单流程、项目投标、项目培训、项目验收等一系列工作，能够对各个环节进行把控，及时有效地处理合作中出现的问题，有效地提升顾客满意度  要求：1. 本科及以上学历，经济、信息、管理、营销或相关专业；　　　　　2. 对经济大数据及城市信用监测领域有一定的了解为佳3. 具有敏锐的市场洞察能力，良好的商务合作洽谈技巧，逻辑思维敏捷4. 市场开拓能力强，能承担一定的销售压力并完成销售任务5. 良好的团队管理、工作协调能力，具有出色的人际交往和社会活动能力　　　　　6. 有信息产品、数据库销售和信用销售等相关经验者优先 　　　　　7. 热爱销售和互联网行业，有政府类客户资源者优先。 待遇:底薪+提成+补助+福利1.底薪：13薪，5K-8K（视工作能力及客户资源确定）2.五险一金外加补充医疗3.福利：带薪年假、旅游补助、节日福利、定期体检、交通补助、午餐补助、通讯补助等 "
