company,city,edu,resumeCount,salary,jobName,detail
国网信息通信产业集团有限公司北京分公司,北京,本科/5-10年,10,15K-20K,大数据咨询策划,"基本素质要求：学历：本科 年龄：30 岁— 35 岁      性别：男/女 专业：计算机、通信及相关专业  相关工作经验： 5 年以上   专业知识及技能要求：有城市大数据方向的咨询、开发、运营、交付经验（至少具备一项）。 能力素质要求：1、本科或以上学历，有三年以上大数据底层开发及相关技术工作经验，熟悉至少一种结构化数据库和至少一种非结构化数据库的底层运行原理，体系架构和优缺点；2、2年+Spark/hadoop系统研发经验，有大型互联网服务的设计和开发经验者优先；3、MapReduce及其他并行计算的实践经验，或者HDFS等分布式文件系统的实践经验者优先；4、需要熟悉大数据，数据治理，主数据，元数据以及云计算等相关架构；5、精通数据库产品性能分析和测试，对数据库的优化，存储性能有较深的研究和操作经验；6、拥有使用SQL,Linux以及本地或云端分布式计算平台（例如 HDInsight，EMR,BigQuery，Hadoop等）的经验；7、拥有至少一种相关开发编码能力，Python/R，Scala/Java，net等;8、具备较强的分析技能和问题解决能力，有较强的学习能力，具有较强的沟通能力。工作职责：（重点工作，协助工作，参与工作）1、 负责城市大数据业务规划顶层设计，通过大数据产业架构，业界动态洞察，情报与战略分析，准确的把握大数据产业发展趋势，商业趋势，政策导向，为部门构建战略性大数据组织架构提供有效解决方案。2、 对项目大数据落地项目的系统架构及质量负责。负责大数据战略项目及高级政府部门的牵引与支撑，帮助公司提升大数据市场格局，增加市场影响力。3、 通过解读国家政策，分解国家战略，匹配区域政治定位，结合公司能力，制定大数据3-5年愿景规划解决方案，能从业务架构，技术架构，应用架构角度实现解决方案落地。4、 研究最新国外、国内大数据行业现状、大数据产业生态和案例，完善解决方案体系及架构方法，协助建立相关领域知识库和成果库。5、补充团队产业规划能力，不断提升团队的专业水平。"
北京通付盾数据科技有限公司,北京,本科/1-3年,96,10K-15K,大数据测试工程师,职责描述：1、根据产品规范编写测试计划，设计测试数据和测试用例并评审；2、执行软件测试，完成对产品的集成测试与系统测试，对产品的功能、性能及其他方面的测试负责；3、对软件问题进行跟踪分析和报告，推动测试中发现问题及时合理地解决；4、汇总测试执行情况，出具相关报告；对开发团队的流程及各环节产出物进行质量监督审核。任职要求1、计算机相关专业，2~3年工作经验，本科及以上学历；2、具有软件测试理论基础，熟悉常见的软件测试工具和测试方法；3、学习能力强，至少会一种脚本语言（Python，Shell等）；4、熟悉jmeter，loadrunner，selenium等测试工具，了解自动化测试框架优先；5、工作态度积极，认真， 有责任心。能承受一定的工作压力，乐于分享、优秀的沟通技能及团队协作能力。
中电科大数据研究院有限公司,成都-高新区,硕士/5-10年,3,18K-25K,大数据系统架构师,岗位职责：1、负责大数据系统的规划和架构设计工作，主导系统的架构设计与核心模块开发；2、负责研究技术发展方向，探索新技术领域，将新技术应用到项目；3、负责技术规范制定，指导开发团队进行实施工作；4、支持技术团队的建设与能力培养。任职资格：1、计算机相关专业，硕士及以上学历，5年以上相关工作经验；2、熟悉大数据相关技术，如Spark、Hadoop、Hive、HBase、Pig、Sqoop、MapReduce等，有丰富的大数据系统架构设计经验；深刻理解大数据系统相关技术和实现；3、熟悉主流的应用与服务开源框架，如Java EE相关开源框架，有应用与服务的架构设计经验，熟悉设计模式，面向服务等思想并应用到架构设计当中；4、了解数据挖掘算法与自然语言处理者优先；5、熟悉项目管理理论，敏捷开发实践方法，有领导技术团队能力者优先；6、逻辑思维能力严密，分析判断能力强，具备一定的独立沟通、协调能力。
苏州宽连信息技术有限公司,南京-雨花台区,本科/3-5年,2,9K-15K,大数据产品经理-南京,职位描述：1、负责大数据营销产品框架搭建；2、协同团队实现产品开发、上线；3、跟进客户反馈，优化迭代产品，建立产品标准化。任职要求： 1、本科以上学历，3年以上互联网产品经验；2、负责过大数据营销相关产品，熟悉相关产品搭建及实现过程；3、具有良好的逻辑思维与系统分析能力，对设计和细节敏感；4、具有良好的团队协作意识、综合沟通能力，责任心强，抗压性强；5、熟悉SQL查询，工作经历有My SQl/HIVE等的优先；6、对数据挖掘、机器学习等基本概念了解，对数据分析和应用敏感。
中电科大数据研究院有限公司,成都-高新区,硕士/不限,1,18K-25K,总体论证专家（大数据安全）,岗位职责：1.承担大数据安全相关领域（大数据安全体系架构及安全算法、数据隐私保护技术、安全审计技术等）的方案设计和关键技术研究工作。2.负责政府数据共享交换场景下的安全保障体系设计、项目规划、方案撰写、标准起草等工作。3.负责或参与政务数据安全与隐私保护相关领域的需求分析、项目论证、解决方案交付等工作。任职要求：1.计算机相关专业，硕士及以上学历。2.具有3年以上信息安全从业经验，熟悉主流信息安全方案及原理，有研发及产品管理经验。3.具有云计算与大数据安全体系专业知识，对云计算与大数据安全体系架构、信息安全技术、大数据脱敏技术等有一定的理论基础。4.具有较好的问题分析能力、逻辑思维能力和方案文档编写能力。5.具有团队合作精神、良好的语言表达、文字表达及沟通能力，良好的英文阅读及听说水平优先。6. 有CISSP、ITIL等安全管理专业资质者优先。
苏州宽连信息技术有限公司,杭州,本科/3-5年,1,10K-15K,大数据产品经理,职位描述：1、负责大数据营销产品框架搭建；2、协同团队实现产品开发、上线；3、跟进客户反馈，优化迭代产品，建立产品标准化。任职要求： 1、本科以上学历，3年以上互联网产品经验；2、负责过大数据营销相关产品，熟悉相关产品搭建及实现过程；3、具有良好的逻辑思维与系统分析能力，对设计和细节敏感；4、具有良好的团队协作意识、综合沟通能力，责任心强，抗压性强；5、熟悉SQL查询，工作经历有My SQl/HIVE等的优先；6、对数据挖掘、机器学习等基本概念了解，对数据分析和应用敏感。
中电科大数据研究院有限公司,成都-高新区,硕士/1-3年,0,15K-20K,大数据安全研发工程师,岗位职责：1.承担大数据安全相关领域（大数据安全体系架构及安全算法、数据隐私保护技术、安全审计技术等）的方案设计和关键技术研发工作。2.负责政府数据共享交换场景下的安全保障体系设计、项目规划、方案撰写、标准起草等工作。3.负责或参与政务数据安全与隐私保护相关领域的需求分析、项目立项等工作。任职要求：1.计算机相关专业，硕士及以上学历。2.具有云计算、大数据安全体系专业知识，对云计算与大数据安全体系架构、信息安全技术、大数据脱敏技术等有一定的理论基础。3.具有较好的问题分析能力、逻辑思维能力和方案文档编写能力。4.具有团队合作精神、良好的语言表达、文字表达及沟通能力。
河南聚云客网络科技有限公司,郑州,大专/1-3年,1,6K-8K,大数据销售+不加班+双休,技能要求：﻿销售，售前支持，售后支持，销售顾问，数字营销，软件销售任职要求：1、具有良好的沟通能力和语言表达能力；2、学习能力强，能不断的学习进步；3、有无销售经验均可。岗位职责：1、网络上及时与客户沟通，维护客户关系；2、对公司产品进行网络推广和销售 ；3、按时参加公司组织的专业培训，提升自身能力；4、完成上级安排的其他工作。福利待遇：1．底薪3K+高提成+奖金（周奖+月奖+年终奖）人均月薪6000+，月薪过万不是梦，销冠记录等你破！2．广阔的发展空间：销售代表--销售主管--销售经理--销售总监，另有横向发展，提供转岗机会。3．依照国家规定为员工享有带薪年假、产假、婚丧假，享受国家规定的法定节假日、节日补贴礼品或奖金；4．享受公司提供的活动经费、员工生日party、参加公司聚餐、定期旅游、唱K、拓展活动、周年晚会！工作时间:9:00-12:00  14:00-18:30，朝九晚六，每天8小时，单双轮休，法定节假日带薪休假。联系人：郭老师  15225190341工作地址：郑州市金水区金水路与玉凤路浦发国际金融中心（名门地产）2301室
苏州宽连信息技术有限公司,苏州-工业园区,本科/3-5年,1,9K-15K,大数据产品经理-苏州,职位描述：1、负责大数据营销产品框架搭建；2、协同团队实现产品开发、上线；3、跟进客户反馈，优化迭代产品，建立产品标准化。任职要求： 1、本科以上学历，3年以上互联网产品经验；2、负责过大数据营销相关产品，熟悉相关产品搭建及实现过程；3、具有良好的逻辑思维与系统分析能力，对设计和细节敏感；4、具有良好的团队协作意识、综合沟通能力，责任心强，抗压性强；5、熟悉SQL查询，工作经历有My SQl/HIVE等的优先；6、对数据挖掘、机器学习等基本概念了解，对数据分析和应用敏感。
深圳市联影医疗数据服务有限公司,深圳-南山区,大专/5-10年,14,15K-25K,医疗大数据开发组长,"岗位职责：1、负责规划公司大数据技术发展路线、制定大数据平台基础平台的技术架构设计、制定技术规范、完善开发流程，打造医疗大数据平台；2、和产品团队深入合作，解决在业务发展中遇到的产品和平台架构问题，并对现有的大数据平台进行优化；3、对数据业务或医疗业务有一定的理解能力，能够将业务的思路融入到数据产品的规划和设计上；4、基于医疗行业数据,挖掘数据价值，负责实现各类病历档案、数据源整合，监控预测和平台类数据产品;5、分配工作任务，培训团队成员，并进行技术分享保持团队对相关技术的理解和普及。岗位要求：1、5年以上大数据研发经验，对Linux操作系统熟练掌握，熟悉shell脚本编程和大数据开发编程（Java, Python）；2、对Hadoop生态圈有深刻理解，掌握Map/Reduce、HBASE、HIVE、Spark中两种以上开发技术，并有实际产品的上线应用；3、具备医疗行业信息化产品或者研发领域行业经验优先；4、具有清晰的系统思维逻辑，对大数据架构设计与核心部件开发以及业界新技术追踪有浓厚兴趣；5、有良好的项目落地和推动能力、能够跨团队组织、推动项目落地，有大数据团队管理经验优先；6、良好的沟通和分析问题与解决问题能力。"
河南聚云客网络科技有限公司,郑州,不限/不限,3,4K-6K,大数据网络销售+双休+高提成+无限,任职要求：1、年龄18-35岁，男女不限；2、具有良好的沟通能力和语言表达能力；3、学习能力强，能不断的学习进步；4、个性开朗、反应敏捷，有较强责任和良好的客户服务意识；5、有无销售经验均可。岗位职责：1、热爱互联网工作，能熟练操作电脑及手机微信即可；2、网络上及时与客户沟通，维护客户关系；3、对公司产品进行网络推广和销售 ；4、按时参加公司组织的专业培训，提升自身能力；5、完成上级安排的其他工作。工作时间:9:00-11:30   13：30-18:00，每天8小时，单双轮休，法定节假日带薪休假。我们提供：1．富有竞争力的薪酬待遇：底薪3K+高提成+奖金（周奖+月奖+年终奖）人均月薪6000+，月薪过万不是梦，销冠记录等你破！2.完美的上班时间：朝九晚六，8小时办公，不必行走匆匆，还能轻松避开早高峰!3．广阔的发展空间：销售代表--销售主管--销售经理--销售总监，另有横向发展，提供转岗机会。年轻我们靠实力，谁说我们没资历？4．高大上办公环境：环境优美，空气清新，快乐办公，生活轻松。5．依照国家规定为员工享有带薪年假、产假、婚丧假，享受国家规定的法定节假日、节日补贴礼品或奖金；6．享受公司提供的活动经费、丰富下午茶、员工生日party、参加公司聚餐、定期旅游、唱K、拓展活动、周年晚会、抽奖！联系人：王老师  18768851017工作地址：郑州市金水区金水路与玉凤路浦发国际金融中心（名门地产）2301室
河南聚云客网络科技有限公司,郑州,不限/不限,7,6K-8K,大数据网络销售（4k+双休+奖金福利）,技能要求：售前支持，售后支持，销售顾问，营销，软件销售任职要求：1、具有良好的沟通能力和语言表达能力；2、学习能力强，能不断的学习进步；3、有无销售经验均可。岗位职责：1、网络上及时与客户沟通，维护客户关系；2、对公司产品进行网络推广和销售 ；3、按时参加公司组织的专业培训，提升自身能力；4、完成上级安排的其他工作。福利待遇：1．底薪3K+高提成+奖金（周奖+月奖+年终奖）人均月薪6000+，月薪过万不是梦，销冠记录等你破！2．广阔的发展空间：销售代表--销售主管--销售经理--销售总监，另有横向发展，提供转岗机会。3．依照国家规定为员工享有带薪年假、产假、婚丧假，享受国家规定的法定节假日、节日补贴礼品或奖金；4．享受公司提供的活动经费、员工生日party、参加公司聚餐、定期旅游、唱K、拓展活动、周年晚会！工作时间:9:00-12:00  14:00-18:30，朝九晚六，每天8小时，单双轮休，法定节假日带薪休假。联系人：郭老师  15225190341工作地址：郑州市金水区金水路与玉凤路浦发国际金融中心（名门地产）2301室
深圳市联影医疗数据服务有限公司,深圳-龙岗区,大专/5-10年,10,15K-25K,医疗大数据开发组长,"岗位职责：1、负责规划公司大数据技术发展路线、制定大数据平台基础平台的技术架构设计、制定技术规范、完善开发流程，打造医疗大数据平台；2、和产品团队深入合作，解决在业务发展中遇到的产品和平台架构问题，并对现有的大数据平台进行优化；3、对数据业务或医疗业务有一定的理解能力，能够将业务的思路融入到数据产品的规划和设计上；4、基于医疗行业数据,挖掘数据价值，负责实现各类病历档案、数据源整合，监控预测和平台类数据产品;5、分配工作任务，培训团队成员，并进行技术分享保持团队对相关技术的理解和普及。岗位要求：1、5年以上大数据研发经验，对Linux操作系统熟练掌握，熟悉shell脚本编程和大数据开发编程（Java, Python）；2、对Hadoop生态圈有深刻理解，掌握Map/Reduce、HBASE、HIVE、Spark中两种以上开发技术，并有实际产品的上线应用；3、具备医疗行业信息化产品或者研发领域行业经验优先；4、具有清晰的系统思维逻辑，对大数据架构设计与核心部件开发以及业界新技术追踪有浓厚兴趣；5、有良好的项目落地和推动能力、能够跨团队组织、推动项目落地，有大数据团队管理经验优先；6、良好的沟通和分析问题与解决问题能力。"
网聚海数(杭州)数据科技有限公司,杭州,本科/1-3年,9,10K-15K,大数据开发工程师,岗位职责：1.负责运营商数据分析平台、精准营销系统的设计和开发；2.负责运营商数据仓库ETL的开发，以及相关数据产品的设计与开发；3.负责用户画像相关工作。任职资格：1.具有数据仓库相关开发经验，如ETL，建模等，熟悉数据仓库模型；2.熟练应用主流关系型数据库，精通SQL，有一定的SQL编写和优化调优经验；3.有用户画像模型构建经验者优先，有数据分析产品开发经验者优先；4.对数据领域技术栈：Hbase，HADOOP，spark，hive等技术熟悉，以及对各种数据处理算法感兴趣者优先；5.至少熟悉JAVA/SCALA/PYTHON中的一种，接触、了解过运营商数据优先；6.良好的沟通能力及团队合作精神，耐心细致，责任心强，能承受较大的工作压力。
深圳市联影医疗数据服务有限公司,深圳-南山区,本科/1-3年,33,9K-15K,大数据开发工程师,"岗位职责：1、通过对业务和数据调研，进行数据模型（数据仓库）设计，协同产品开发，数据分析团队进行开发工作。2、负责医疗卫生大数据平台的部署、开发和维护；3、利用医疗卫生大数据平台实现对数据的抽取、清洗、转换，分析、处理、挖掘；4、完成开发文档、项目实施维护文档等材料撰写；5、保证所负责项目的交互质量，达到质量考核要求。岗位要求：1、计算机本科及以上学历，2年及以上Linux/Unix系统下数据相关开发经验。2、熟悉shell,python等脚本语言。熟悉MYSQL或其他大型数据库，有一定SQL编码及调优经验，熟悉java,Scala等语言更优。3、熟悉Hadoop，Spark，Storm等大数据计算框架以及TensorFlow，pytorch等深度学习平台，有海量数据处理经验。有用户画像和知识图谱相关积累。4、具备医疗行业信息化产品或者研发领域行业经验优先。5、自我驱动力强、有高度责任心和团队合作精神。"
北京卓思天成数据咨询股份有限公司,北京-朝阳区,本科/3-5年,13,15K-25K,研究经理（大数据营销方向）,岗位职责：该岗位主要从事汽车行业相关的大数据研究咨询服务，并协助完成研究成果的平台化开发：1. 主要从事大数据角度的汽车个案研究尤其是消费者研究工作； 2. 担任中小型项目的项目经理，在项目总监的带领下保证项目顺利推进并高效完成； 3. 高度参与整个项目过程，从项目设计、进度管理、质量控制到数据分析和报告撰写，并能独立负责部分环节； 4. 协助完成项目研究成果的网络平台开发；5. 参与竞标，能够在项目总监辅助下参与计划书及报告的演示和讲解；6. 参与公司流程/体系的创新与完善，以及新产品及服务的开发；7. 关注行业动态，撰写行业分析文章。任职要求：1. 3年以上汽车行业市场研究咨询经验，有大数据研究经验者优先； 2. 有外资汽车品牌服务经验者优先；3．出色的中、英文书面及口头表达能力，良好的沟通及跨部门协作能力，能高效地解决问题； 4. 学习能力强，愿意接受新事物和新挑战； 5. 思维敏捷，做事认真，对数据敏感；6. 积极主动，自信，乐观，勇于承担责任，抗压能力强。
深圳商道卓越投资服务有限公司,长沙-芙蓉区,大专/不限,1,8K-10K,大数据算法实习生,实习岗位，欢迎优秀应届毕业生投递简历入职要求：1、18-26岁，专业不限，大专及以上学历者优先2、需对计算机、游戏开发、设计、网站建设有兴趣3、有一定的逻辑思维，会简单电脑操作4、面试通过，直接上岗，无经验者，人品优秀可先带薪实习后上岗岗位职责：1、软件开发/设计等相关专业大专或以上学历；2、具有一定的C/C 语言基础，掌握数据结构相关知识；3、熟练操作Windows、Office等办公软件；4、善于学习，深入了解嵌入式系统软件及开发环境；5、具有良好的编码习惯，编写结构清晰、命名规范、逻辑性强、代码效率高；6、深入理解软件工程思想；7、具有良好学习能力和团队合作精神。福利待遇：1、周末双休，每天7小时上班时间，无夜班，不加班。2、大量有奖金项目可做，能力强者可不限量接受奖金项目，3、公司为员工购买五险一金，定期组织员工生日会、野外游玩等活动，提供良好的晋升机制，广阔的提升空间。
广州找原料电子商务有限公司,广州-白云区,大专/1-3年,1,10K-15K,大数据资深售前顾问（双休+六险一金）,需求企业：某国内IT，互联网，大数据等领域高科技领军企业。主要业务产品为云计算、大数据集成系统、智慧城市等；岗位职责：1、了解业界主流大数据产品，大数据生态，了解市场大数据的典型应用场景，配合销售进行产品宣讲和解决方案展示；2、理解目标市场，搜集市场信息，分析需求和行业趋势，包括但不限于涵盖政府、快消品运营商、金融等行业的大数据典型应用场景；3、为客户提供大数据解决方案，满足客户需求，主导项目的技术方案部分，完成项目策划、招投标等前期工作。任职要求：1、2年以上大数据方案咨询或项目经理经验；2、具备优秀的沟通协调能力和方案撰写、演示能力；3、具有较好的客户需求理解能力、出色的表达沟通能力和售前讲解能力，逻辑结构强，善于挖掘和引导客户需求，能独立撰写演示文档、技术及服务方案等文档。公司福利：1、六险+公积金：入职后购买六险一金2、节假日：双休，享受法定节假日，带薪年假、婚假、产假等3、节假日福利：重大节日礼品4、公司活动：经费支持，不定期组织文体活动、聚餐活动、团建活动5、职业发展：广阔的职业发展平台，双向晋升，学习培训6、工作时间：周一到周五，八小时工作制7、奖励：团队奖、年终大奖、公司提供的各种奖励8、公司平台大，起点高，晋升发展路线明确。职业前景：丰厚底薪+高提成+奖金，收入不封顶，工作时间自主，公司提供专业培训和升职通道。公司介绍：找原料网创始团队由前阿里、猫扑、YY直播、人人网等互联网一线团队和行业专业精英团队组成；作为国家高新技术企业，自2015年创立之初，在创始团队共同努力和行业的支持下，不断地优化平台和服务客户；并专注于互联网创新和跨界融合，利用“互联网+”技术和大数据为美业提供服务。找原料网目前拥有两大创新平台：原料达摩院、美业颜究院 。 “原料达摩院”已为下游工程师及采购提供专业的原料、配方、法规、市场趋势和优质供应商等价值信息及求购发布服务，赋能下游用户的研发打板和采购工作；并高效连接优质原料供应商，为广大供应商企业提供原料推广、营销策划及求购对接等服务；成为全行业高频粘性使用的高效工具。“美业颜究院”是美业领先的大数据定制服务平台，帮助品牌企业深刻洞察消费者和市场趋势变化、品牌和产品规划先机，并精准高效对接新渠道KOL资源；帮助工厂企业深刻洞见目标客户的价值偏好和产品理念，并为客户量身定制更有针对性的产品市场方案；帮助全行业提供更优质的供应链数据。运用互联网大数据驱动美业智能化升级，打造美业行业的ET大脑。找原料网，服务于行业、赋能于行业；通过运用互联网科技与新思维，高效连接行业上下游和实现资源共享；全心服务于美业，努力打造全球专业的美业产业链服务平台！
