company,city,edu,resumeCount,salary,jobName,detail
深圳市菲森科技有限公司,深圳,大专/3-5年,14,10K-20K,IT工程师运维,"一、任职资格：1)28岁以上，40岁以下，计算机信息工程或相关专业全日制本科毕业；2)主导或全程参与过至少一项大型集团企业信息系统或大数据商业智能分析系统的项目实施，熟悉企业信息化流程与基础原理；3)熟悉Oracle、SQL  Server等大型数据库应用分析与运维管理操作，精通SQL/Oracle编程和优化；4)良好的数据分析和问题解决能力，有大型制造企业主数据或数据治理的实施经验或相关项目经验；5)能熟练运用VC#、Java或其它工具进行插件、报表的二次开发工作；6)掌握业内较多合作资源与最新IT技术趋势信息；熟悉大型集团型企业财务系统各模块的关键需求及管控要点，了解医疗器械生产流程；7)责任心强，具备独立处理问题的能力、良好的沟通技巧及团队协作精神，有良好的组织、协调及执行力；8）  有良好的网络、服务器应急处理能力，熟练掌握MPLS  VPN，VRRP、Qos、HRSP等网络技术；具有CCNP、VCP、MCSA证书（优先考虑）9）熟练掌握Cisco、H3C、深信服等网络设备配置、实施与维护;  熟悉各种网络设备，可独立进行网络架构设计、安装、调试，精通办公网络、研发网络、生产网络的网络布线、日常维护和故      障处理；掌握网络安全及防攻击技巧、网络防毒，熟悉常用监控软件的使用；10）精通WINDOWS  server2008与server2012、exchange\AD、Linux操作系统搭建、部署及运维，  熟悉高负载、高流量、大数据的配置、监控、备份、优化,  能对服务器进行维护与管理  ；11）熟悉系统虚拟化的架构和基本原理，熟悉VMware架构管理、能独立虚拟化平台的架构设计、ESXi和VCENTER安装及配置；二、岗位职责：1)围绕公司经营目标的实现，调研、梳理信息化需求，策划、设计信息化方案；2)组织参与信息化系统的项目实施、任务分配、成果交付、考核稽查、培训指导等工作；3)统一规划ERP、OA、HR、CRM、MES、PLM、加密等信息系统正常运行，处理应用中出现的各种问题；4)结合公司业务流程对各信息系统进行调整优化，包括插件、报表的设计开发；5)负责程式与流程的测试分析；负责实施方案、任务计划、考核制度、操作手册、培训文档的编写；6)负责规划及管理企业数据库，监测数据库瓶颈并优化，数据分析应用；负责保障数据中心各服务器安全运行。"
南京瑞沃软件有限公司,南京,本科/不限,1,8K-13K,商业智能工程师,"岗位职责：１．负责数据数据仓库、以及数据类相关系统的设计、开发和维护工作； ２．根据业务规则，进行相关数据模型设计与开发、ETL流程的开发和优化、数据接口开发、相关存储过程代码编写等工作；３．数据标准化实施，数据质量问题分析和处理； 4．负责数据挖掘、分析和应用； 5． 负责全行数据的日常管理。任职要求：1．计算机及相关专业，本科及以上学历，三年以上开发经验；2．良好的数据库设计基础，理解数据仓库理论和实施方法，熟悉数据仓库开发流程，有数据仓库项目开发经验； 3．熟悉DB2、Oracle、GreenPlum等主流数据库；4．熟悉SQL语言和存储过程编写，具有SQL调优能力；5．熟悉一种ETL开发工具，如Datastage等； 6．熟悉Cognos、BO或EOS等BI工具者优先； 7、熟悉UNIX/Linux/AIX操作系统下的应用开发和部署，熟悉常用操作系统命令；8．熟悉大数据技术（Hadoop\Hive\HBase\MapReduce）,有大数据应用开发经验，熟悉可视化开发工具的优先；9．良好的逻辑分析能力、分析问题和解决问题的能力，对数据敏感，有良好的沟通能力；10．有互联网数据研发、海量数据处理分析、BI开发经验者优先。11、熟悉金融行业核心业务、信贷业务、电子渠道、移动应用、支付结算、综合理财、投资托管、风险管控、经营分析、企业总线、协同办公等相关某领域的产品功能、业务流程和应用架构体系优先；12、有丰富的需求分析、架构设计和软件开发经验; 具有较强的责任心和组织协调能力;工作地点：南京"
河南信大网御科技有限公司,郑州,本科/3-5年,1,30K-50K,网络信息安全行业总监,一、岗位职责：1、 负责市场调研，搜集、整理监控产品及系统前沿技术文件，及时了解信息安全行业技术现状和发展趋势，为开发新产品及改善现有产品提供引领，保持产品的持续改进，保持技术的先进性。2、 协助制定信息安全行业相关产品的发展规划和实现路径，组织完成所负责产品的技术路线图设计；3、 制定产品目标，为达成目标协调各个团队的资源，并定期追踪和汇报；4、 管理需求及优先级、完成功能设计、指导和协助研发团队按时按质交付。 二、任职资格： 1、 男，35岁与45岁之间，本科或以上学历。具有三年以上在“网络通信及其安全、大数据及信息安全领域”内相关企业、各大研究机构、电信类设计院的产品策划或研发管理经验；2、精通领域包括但不限于电信网领域（固网、移动网、3G/4G/5G）、移动互联网领域、物联网领域。技术方向包括但不限于硬件管控与分流设备、协议解析、管控技术、安全防范技术、语音识别技术、大数据分析与模型建立等方面。3、良好的产品思维能力，具备优秀的用户需求分析和用户体验细节把握能力；4、具有良好的沟通协调能力、领导力和团队管理能力。 
安徽钊泽信息科技有限公司,宿州,大专/不限,5,5K-9K,4G/5G通信技术工程师5000/月起,一、岗位职责：（1）主要负责移动、联通、电信三大运营商的4G和5G网络优化工作；（2）日常工作主要是对4G\5G通信信号前后台数据进行大数据分析，给出解决问题方案，不涉及体力劳动，办公室办公；（3）具体工作内容：用户投诉处理、道路测试与分析、网络KPI指标优化与提升， 优化报告的输出、明星演唱会、重大活动及节假日的网络保障等。二、任职资格：（1）专业不限，计算机、信息工程、通信工程等专业优先；（2）年满18-35周岁，大专及以上学历，年龄不符合者勿扰；优秀者破格录取；（3）前期能适应省外出差，后期可以稳定下来，不再出差；不能接受出差者勿扰；（4）需要自带笔记本电脑，能简单操作办公软件。三、待遇：（1）上班时间：朝九晚五、双休、享受国家法定节假日；（2）提供住宿，报销来回车旅费；（3）签订劳动合同，提供五险一金；（4）初级5000-9000，中级7000-12000，高级15000以上。四、个人发展空间：（1）技术通道：初级-中级-高级工程师；（2）管理通道：项目经理助理-项目经理-区域总经理；五、温馨提示：可以直接投递简历，人事看到会第一时间联系您！
南京擎盾信息科技有限公司,广州,本科/不限,3,15K-30K,项目经理--广州,岗位职责：1、确保项目目标的实现，领导项目团队准时、优质地完成全部工作。2、 与客户沟通，了解项目的整体需求。并与客户保持一定的联系，即时反馈阶段性的成果，和即时更改客户提出的合理需求。3、 制定项目开发计划文档，量化任务，并合理分配给相应的人员。4、 跟踪项目的进度，协调项目组成员之间的合作。5、 监督产生项目进展各阶段的文档，并与QA即时沟通，保证文档的完整和规范。6、 开发过程中的需求变更，项目经理需要跟客户了解需求，在无法判断新的需求对项目的整理影响程度的情况下，需同项目组成员商量，最后决定是否接收客户的需求，然后再跟客户协商。确定要变更需求的情况下，需产生需求变更文档，更改开发计划，通知QA。7、 项目完成的时候需要项目总结，产生项目总结文档。8、定期组织项目组成员进行相关技术培训以及与项目相关的行业培训等。9、接受阶段性出差10、2年及以上的JAVA开发经验11、有大数据平台开发经验者优先12、有至少2年的项目或开发团队管理经验
安徽钊泽信息科技有限公司,铜陵,大专/不限,1,5K-9K,4G/5G通信技术工程师5000/月起,一、岗位职责：（1）主要负责移动、联通、电信三大运营商的4G和5G网络优化工作；（2）日常工作主要是对4G\5G通信信号前后台数据进行大数据分析，给出解决问题方案，不涉及体力劳动，办公室办公；（3）具体工作内容：用户投诉处理、道路测试与分析、网络KPI指标优化与提升， 优化报告的输出、明星演唱会、重大活动及节假日的网络保障等。二、任职资格：（1）专业不限，计算机、信息工程、通信工程等专业优先；（2）年满18-35周岁，大专及以上学历，年龄不符合者勿扰；优秀者破格录取；（3）前期能适应省外出差，后期可以稳定下来，不再出差；不能接受出差者勿扰；（4）需要自带笔记本电脑，能简单操作办公软件。三、待遇：（1）上班时间：朝九晚五、双休、享受国家法定节假日；（2）提供住宿，报销来回车旅费；（3）签订劳动合同，提供五险一金；（4）初级5000-9000，中级7000-12000，高级15000以上。四、个人发展空间：（1）技术通道：初级-中级-高级工程师；（2）管理通道：项目经理助理-项目经理-区域总经理；五、温馨提示：可以直接投递简历，人事看到会第一时间联系您！
Wolters Kluwer China,北京-朝阳区,本科/1-3年,9,6K-10K,法律编辑,职位描述:1.负责法律数据库（主要是法规、裁判文书等基础内容）的加工与维护，保证准确性、权威性、更新的及时性；2.与团队一起策划并开发新的栏目/功能/产品，使产品更具竞争力；3.参与法律大数据相关工作，根据项目需求，进行数据提取、规则制定；4.定期收集客户需求，对同类产品进行竞品分析，发现不足，并提供可执行的产品改进方案。职位要求:1.法律专业本科及以上学历（应届毕业生亦可）；2.有过律师助理、文案整理、编辑等工作经历者优先；3.对于法律大数据相关工作有较强的兴趣；4.强烈的责任心，良好的人际沟通及协调能力、团队协作能力；5.熟悉Word、Excel、PPT等办公软件。
北京博创智联科技有限公司,北京,大专/1-3年,6,5K-8K,区域销售经理,职责：负责高校嵌入式、物联网、大数据、机器人实验设备在全国相关区域的销售工作上面月薪是基本工资。薪酬=月度工资+月度提成奖励+年终提成奖励+特别奖励基本条件：1、大学本科以上学历，计算机、物联网、电子、自动化等相关专业毕业；2、一年以上销售经验，最好有高校实验室设备销售经验；应届毕业生做过学生干部可以放宽；3、勤奋，敬业，诚信，能吃苦；有高校教育资源的优先录用！欢迎在北京工作的外地销售人员回老家长期发展！欢迎优秀的应届毕业生学生干部应聘！本职位可招当地代理、兼职！
智联招聘网/Zhaopin.com,南京,本科/1-3年,0,6K-8K,咨询顾问/售前顾问, 岗位职责：1.        深挖客户需求，规划长、短期人才招聘策略，帮助企业人才战略落地。2.        数据分析及报告撰写，根据智联大数据平台提取相关需求数据，分析并撰写报告。主要报告类型包含行业薪酬报告、人才流动报告、行业研究及人才发展报告、企业定制化报告等。3.        重要方案讲解，招投标中需要现场呈现和重要客户的定制化招聘方案，负责需求分析、整体流程梳理、项目资源协调、方案撰写及现场呈现。4.        与销售、项目经理、企业端沟通协调工作，确保项目在合理时间内顺利完成。   任职要求：1.        本科及以上学历、海外留学背景优先2.        有行业研究、数据分析、创意策划等相关工作经验3.        具备系统性思维和逻辑思考能力、团队协作能力及表达能力4.        对未知领域具备探索精神，渴望获取新知识5.        善长使用office办公软件
中国平安人寿保险股份有限公司吉林分公司文化街拓展部,长春-朝阳区,不限/不限,0,8K-10K,高薪诚聘车险理赔专员,"岗位职责1、 负责所属区域保险、风控业务的理赔支持工作,负责组织和开展重载商用车反欺诈运用方面的培训和宣讲工作;2、 跟踪和协调重大项目、重大赔案的结案和理赔进展工作,以及保前制定理赔服务方案;维系并管理终端客户关系,并在此基础上扩展业务合作,提升整体服务满意度;3、 负责保险理赔相关线上产品的测试和验证工作;4、 负责保险理赔咨询问题的解答和跟踪,开拓并挖掘大数据在保险反欺诈中的应用;5、 对接各合作主体公司,负责日常赔案风险点排查、其他大数据应用的需求汇总,解决方案制定等;6、 定期对线上产品的使用情况进行跟踪、评估和反馈工作。"
四川德尔博睿科技股份有限公司,南充,大专/1-3年,1,8K-12K,高级研发工程师,"1、负责平台架构优化、核心重要模块开发，有很强的质量意识，主导核心代码开发；3、负责需求、设计产品相关文档编写；3、编写制订各项技术方案；4、负责较高难度的需求分析；5、指导、培训中初级工程师、新员工；6、解决项目中技术难题；7、参与系统安全性、稳定性、性能和扩展性测试。要求：1、五年以上基于Java的Web项目开发经验，具有较好的系统架构设计能力，有互联网产品、分布式应用系统开发经验；2、Java基础扎实，理解常用的设计模式，熟悉基于J2EE的相关开源技术以及熟练运用主流开发框架（Spring, Spring MVC, Hibernate，Mybatis等）；对Spring boot，Spring cloud，Dubbo框架等有使用经验优先；3、熟悉熟悉HTTP,TCPIP,Socket网络通讯协议，熟悉Kafka，RabitMQ等中间件；4、熟悉分布式缓存Redis,Memcache，熟悉SOA, WebService等技术；5、熟悉ORACLE,MySql数据库开发技术及相关工具，熟练掌握SQL，有海量数据系统的开发、调优经验；6、熟悉Linux环境以及操作，SVN的使用，熟悉Tomcat,Apache,Nginx等开源的服务器；7、熟悉微服务架构设计原理，并有过相关实战经验；8、有大数据方面工作经验如hadoop、storm、spark、hbase等技术的优先；9、视频直播相关研发工作经验2年。"
安徽钊泽信息科技有限公司,蚌埠,大专/不限,4,5K-9K,4G/5G通信技术工程师5000/月起,一、岗位职责：（1）主要负责移动、联通、电信三大运营商的4G和5G网络优化工作；（2）日常工作主要是对4G\5G通信信号前后台数据进行大数据分析，给出解决问题方案，不涉及体力劳动，办公室办公；（3）具体工作内容：用户投诉处理、道路测试与分析、网络KPI指标优化与提升， 优化报告的输出、明星演唱会、重大活动及节假日的网络保障等。二、任职资格：（1）专业不限，计算机、信息工程、通信工程等专业优先；（2）年满18-35周岁，大专及以上学历，年龄不符合者勿扰；优秀者破格录取；（3）前期能适应省外出差，后期可以稳定下来，不再出差；不能接受出差者勿扰；（4）需要自带笔记本电脑，能简单操作办公软件。三、待遇：（1）上班时间：朝九晚五、双休、享受国家法定节假日；（2）提供住宿，报销来回车旅费；（3）签订劳动合同，提供五险一金；（4）初级5000-9000，中级7000-12000，高级15000以上。四、个人发展空间：（1）技术通道：初级-中级-高级工程师；（2）管理通道：项目经理助理-项目经理-区域总经理；五、温馨提示：可以直接投递简历，人事看到会第一时间联系您！
安徽钊泽信息科技有限公司,安庆,大专/不限,1,5K-9K,4G/5G通信技术工程师,一、岗位职责：（1）主要负责移动、联通、电信三大运营商的4G和5G网络优化工作；（2）日常工作主要是对4G\5G通信信号前后台数据进行大数据分析，给出解决问题方案，不涉及体力劳动，办公室办公；（3）具体工作内容：用户投诉处理、道路测试与分析、网络KPI指标优化与提升， 优化报告的输出、明星演唱会、重大活动及节假日的网络保障等。二、任职资格：（1）专业不限，计算机、信息工程、通信工程等专业优先；（2）年满18-35周岁，大专及以上学历，年龄不符合者勿扰；优秀者破格录取；（3）前期能适应省外出差，后期可以稳定下来，不再出差；不能接受出差者勿扰；（4）需要自带笔记本电脑，能简单操作办公软件。三、待遇：（1）上班时间：朝九晚五、双休、享受国家法定节假日；（2）提供住宿，报销来回车旅费；（3）签订劳动合同，提供五险一金；（4）初级5000-9000，中级7000-12000，高级15000以上。四、个人发展空间：（1）技术通道：初级-中级-高级工程师；（2）管理通道：项目经理助理-项目经理-区域总经理；五、温馨提示：可以直接投递简历，人事看到会第一时间联系您！
广西小虎牙科技有限公司,柳州,本科/3-5年,0,8K-15K,系统架构师,岗位职责：1、负责JAVA研发团队的管理，制定部门发展计划；2、负责系统架构的搭建和评估，负责软件开发方案的制定和修改；3、主导技术难题攻关，分析系统瓶颈，解决各种疑难杂症，对系统进行性能调优；4、跟踪项目进度，协调项目组成员之间的合作；5、对代码质量和测试进行全面的把控，保障线上服务的稳定性。任职要求：1、本科及以上学历，工作认真负责、积极主动、有良好的沟通协调能力、语言表达能力；2、3年以上开发团队管理经验，5年以上Java开发运用经验；3、拥有良好的代码习惯，代码冗余率低；4、独立完成过应用系统的需求分析、概要设计、详细设计、数据结构设计；5、有独立负责过大数据分析项目开发经验优先考虑。
深圳市诚建通非融资性担保有限公司,杭州-下城区,大专/不限,0,8K-15K,销售经理,技能要求：大客户代表，销售诚建通立足于金融服务领域，主营工程保函业务，公司以国家政策为发展导向，专注做工程保函卓越品牌，行业排名前三。工作时间：一周工作5天，每天7.5小时工作制（8:30-12:00 13:30-17:30），周末双休。所有假日按国家规定标准。薪酬结构：底薪+提成+奖金+多元化福利  ，优秀客户经理年薪（10-20W）福利：五险一金（入职即可购买）、交通补贴、通话补贴、公司旅游、生日礼、过节福利、结婚生子礼金、带薪年假等岗位职责：1、通过公司的系统的培训，能够快速熟悉公司产品 融入团队并掌握销售模式 ；2、通过公司内部客户管理系统快速建立客户档案（内部资源），以优质的服务维护好客情关系，对客户需求进行持续追踪，从而维系产生一批忠诚优质的客户群体；3、通过公司大数据分析及团队战略规划快速进入市场开拓自有客户资源从而达成销售目标；任职资格：1、 年龄：22-30岁2、 学历：大专及以上学历3、 经验：一年以上销售工作经验。欢迎优秀应届毕业生加入4、 性格：韧性、踏实、外向，热情，乐观，上进、亲和力佳5、 能力：优秀的沟通能力、协调能力、商务谈判能力、学习能力、适应能力、抗压能力晋升空间：业务方向：客户经理→高级客户经理→资深客户经理→金牌客户经理管理方向：客户经理→销售主管→分公司经理→区域总监优秀者可破格晋升。我们是做什么的？答：我们公司属于金融服务行业，主营工程保函业务，从事工程项目保证工作。工程项目包括：1、房建 2.市政 3.道路 桥梁 4.铁路 轨道交通 5.园林绿化 6.水利水电 7.机电安装 8.环保施工 9.石油化工施工 10.送变电工程等，主要是与公共类、市政类、民生类工程有关的项目。什么是工程担保?答：工程保证担保称为“绿色担保”，在国外有100多年的历史。工程担保以其特有的方式，保证了建筑行业快速健康的发展，发达国家行业年收入达20多亿美元。工程保证担保通过经济手段，规避工程风险、保障合同履约、规范市场行为、维护工程建设各方的利益。我们的客户群体？答：工程类企业，对象是企业高管或企业决策人。我们的服务案例？答：杭州湾跨海大桥、杭州地铁、上海中心大厦、港珠澳大桥、南水北调工程、阿里地区民生工程、杭州奥体中心、杭州东站等中国知名工程，所有的工程项目均顺利履约。我们行业的发展前景？答： 我国作为发展中国家，在建设社会主义市场经济的过程中工程保证担保制度一百多年的发展历程，已经证明它对规范建筑市场、防范建筑风险特别是质量风险、降低建筑业的社会成本等方面都有十分重要和不可替代的作用。引进并建立符合中国国情的工程保证担保制度是完善我国建筑市场法制建设的重要举措，也是我国建筑业和保证担保业在我国加入世贸组织后参与国际竞争以及与世界接轨的必然要求。（详尽内容可百度搜索“工程保证担保”）
深圳市易思博酷客科技有限公司,深圳,大专/3-5年,3,10K-15K,Go后台开发工程师,工作职责：1、负责公司AI系统层的功能研发与系统优化；2．负责相关AI系统维护，确保系统运行稳定可靠3、参与公司重要产品的用户调研、需求分析、技术方案的制定并撰写相关技术文档。任职要求：1、计算机或相关专业本科或以上学历，3年以上相关工作经验；3、具有AI产品系统层开发经验者优先；4、技术栈：至少熟悉或精通Go/JAVA其中之一编程语言；4，熟悉网络编程，了解TCP/IP，HTTP等工作原理；5、熟悉Linux系统开发者优先；8、具有storm，Hadoop，openstack 等经验者优先；6、有视频编解码/视频内容分析相关经验者优先7、有大数据量、高并发系统和大型网站构建经验者优先。8、学习能力强，拥有较强的逻辑思维能力，对问题有钻研精神，有较好的沟通交流能力；
深圳市斯凯荣科技有限公司,深圳-南山区,本科/5-10年,13,25K-35K,高级java架构师,"岗位职责:         1、规划业务应用系统和基础平台的技术架构，参与需求分析、建模、架构设计、技术决策以及详细设计；         2、把握复杂系统的设计，确保系统的架构质量，编写核心部分代码；         3、带领团队攻克例如大数据量、高并发、高稳定性等带来的各种挑战及技术难关；         4、进行团队技术的培训；         任职条件:         1、计算机相关专业，8年以上研发经验，4年架构相关工作经验,有千万级用户并发架构设计优先；         2、精通Java开发技术，掌握主流微服务开发框架（springcloud,dubbo），熟悉Shell、GO语言优先；         3、编程基础扎实，熟悉I/O、多线程、集群等基础框架和原理，熟悉分布式、缓存、消息等机制；         4、熟悉常用设计模式，代码评审规则，单元测试，持续集成；         5、熟悉AWS云服务；         6、熟悉容器技术原理、生态系统，熟悉Docker、Mesos、Kubernetes等容器系统、大规模容器资源调度系统、分布式应用生命周期管理框架。熟悉云计算/容器和网络技术，具备大规模集群设计及管理经验；         7、具有大数据相关技术（HDFS、MR、HBase、Flume、Kafka、spark、Mongo等）实际使用经验；         8、优秀的分析问题和解决问题的能力，对解决挑战性问题充满激情；"
